"UNHCR is currently working with the authorities and other actors to determine the size of the population that found an effective nationality solution under Law 169-14. Since the adoption of Law 169-14 in May 2014, important steps have been taken by the Dominican Republic to confirm Dominican nationality through the validation of birth certificates of individuals born in the country to two migrant parents before 2007. According to information shared by the Dominican delegation during the 2019 High-Level Segment on Statelessness, approximately 48 per cent of the total Group A population of 61,049 persons had been authorized by the National Electoral Board (JCE) to request their nationality documentation. Additionally, as of December 2019, over 1,700 Group B persons (900 of which were children) had submitted applications for naturalization to the Ministry of Interior and of the Police (MIP). However, no naturalization decisions concerning this population had been issued by June 2023.",2023,,DOM,STA
"With respect to persons under UNHCR’s statelessness mandate, this figure includes persons of concern covered by two separate Latvian laws. 160 persons fall under the Republic of Latvia’s Law on Stateless Persons on 17 February 2004. 187,404 of the persons fall under Latvia’s 25 April 1995 Law on the Status of those Former USSR Citizens who are not Citizens of Latvia or Any Other State (“Non-citizens”). In the specific context of Latvia, the “Non-citizens” enjoy the right to reside in Latvia ex lege and a set of rights and obligations generally beyond the rights prescribed by the 1954 Convention relating to the Status of Stateless Persons, including protection from removal, and as such the “Non-citizens” may currently be considered persons to whom the Convention does not apply in accordance with Article 1.2(ii).","2022 - 2023",,LVA,STA
"This figure presents an estimate of persons with undetermined nationality/at risk of statelessness, based on a survey conducted by the Directorate General of Immigration and Emigration (DGIE) in 2010, which found approximately 9,500 persons to be at risk of statelessness. Efforts are underway to conduct a survey that will provide an updated and reliable statistics in 2023.",2023,,RWA,STA
"The total statelessness figure includes 581,900 stateless persons reported by the Royal Thai Government and registered with the national civil registration system by the mid 2023.",2023,,THA,STA
"The data are generally provided by governments, based on their own definitions and methods of data collection.",2022,,,
"The figures for Spain from January-June 2023 include cases granted refugee status (7%), subsidiary protection (4%) and cases that were granted authorization to stay based on humanitarian reasons (50%).",2023,,ESP,ASY
"Pending a more accurate study into statelessness in Iraq, the figure is an estimate based on various sources.",2022,,IRQ,STA
"Refers to Palestinian refugees under the UNHCR mandate only.","2022 - 2023",PSE,,REF
"In the absence of official data, the figure reported refers to stateless persons and persons with undetermined nationality identified by UNHCR partner organizations in Turkmenistan. The decrease in the reported figure corresponds to those people who were naturalized or who had another nationality confirmed.",2023,,TKM,STA
"More than 90,000 people in a refugee-like situation were reported for the first time, primarily Haitian nationals, who have received humanitarian visas in the country.",2023,,BRA,REF
"Data is as of end-2019.",2022,,MCO,
"The methodology for estimating the number of refugees in Australia is under review and subject to adjustment in future reports.",2022,,AUS,REF
"No official data on the actual number of refugees residing in Bulgaria is available. The estimate includes 160,500 Ukrainians who received temporary protection, and 29,100 other refugees.",2023,,BGR,REF
"The number of refugees will be re-estimated based on the data received from from the government as of start 2022.",2022,,NLD,REF
"The number of other people in need of international protection is estimated from the Regional Refugee and Migrant Response Plan.","2022 - 2023",,CHL,OIP
"The number of refugee returns to Ukraine is estimated using the IOM DTM data Round 13. The report estimates that 861,000 refugees have returned for three months or more, which may (in light of the high frequency of pendular movements between Ukraine and host countries) indicate an intention for a stable return. Of these 158,000 have returned for between 3 and 6 months and are reported in 2023 statistics, while 703,000 returned more than 6 months ago and are reported retroactively in 2022. In addition, 353,000 refugees have returned to locations in Ukraine that are not their place of origin. UNHCR estimates that 39,000 of them returned in the first six months of 2023, with 314,000 having returned in 2022.","2022 - 2023",UKR,,RET
"UNHCR is currently engaged in ongoing discussions with the Australian Government about how best to reflect Afghan refugee arrivals. The total number of Afghan refugee resettlement arrivals may change in future reports. Many of the Afghan resettlement arrivals include individuals that arrived in Australia on 449 visas and were subsequently converted to offshore humanitarian visas. As a result, not all of the arrivals may have occurred in 2022.",2022,,AUS,
"Host community refers to a community that hosts large populations of refugees or internally displaced persons, whether in camps, integrated into households, or independently. UNHCR reports on host communities in countries with substantive programmes focusing on sharing the burden of hosting large refugee populations, as set out in the Global Compact on Refugees.",2022,,,HST
"The 2014 ministerial declaration that offered Prima Facie refugee status to persons fleeing generalised violence from Central African Republic from January 2013 onwards is no longer applicable. As such, all refugees are assessed on an individual basis by the National Commission for Refugees.","2022 - 2023",,COD,"REF,ASY"
"The number of in situ stateless persons is based on results from the 2011 population census.",2023,,CZE,STA
"The total stateless population in Malaysia includes 8,700 non-displaced stateless persons who may be entitled to Malaysian nationality under the law. This number of non-displaced stateless persons is based on a registration and community legal assistance programme undertaken in West Malaysia by a local NGO with technical support from UNHCR.",2023,,MYS,STA
"The statistics on asylum-seekers (new applications, re-opened/repeat applications and/or appeal application) and refugees individually recognized in Canada include persons who had their claim assessed before the Refugee Protection Division and the Refugee Appeal Division of the Immigration Refugee Board as well as by the Department of Immigration, Refugees and Citizenship Canada through a Pre-Removal Risk Assessment.","2022 - 2023",,CAN,ASY
"The figure is an estimate based on previous NGO analysis of government data and may not represent the full magnitude of statelessness in Slovenia.",2023,,SVN,STA
"The Indo-Chinese population in China is no longer considered as refugees under UNHCR's mandate and has been removed from UNHCR's statistical reporting since June 2022, because they have full access to public services and enjoy the same rights as nationals.",2022,,CHN,REF
"Small values between zero and five have been rounded to multiples of five. Data on asylum applications and decisions has additionally been rounded for small values between five and 10. Demographic data has been additionally modified so that the data remains additive.",2022,,,
"Regarding the figure of stateless persons, the estimation 93,770 stateless persons in the Russian Federation is based on the number of self-proclaimed stateless persons identified during the 2020 census (finalized at the end of 2022), of whom 1,391 persons obtained Russian citizenship in the first half of 2023.",2023,,RUS,STA
"The UK’s stateless figures show the number of stateless individuals recognised through the UK's stateless determination procedure since it began in 2013. In previous years, this figure has been calculated by adding all grants of stateless leave. This resulted in unavoidable double counting for stateless individuals who were applying for further statelessness leave after the expiry of their initial grant of leave. The UK Government has now provided data for initial and subsequent grants. The subsequent grants have therefore been removed from the previous cumulative figure between 2013 - 2018. Since 2019, the cumulative figure now only includes initial grants of leave following individuals’ recognition as stateless. At the end of 2022, the total number of individuals recognised under UK’s statelessness determination procedure is 319. UNHCR further provides the number of asylum-seekers and refugees whose nationality has been recorded as ‘stateless’ as part of the asylum process. For this group there has been no formal determination that they are stateless.",2022,,GBR,STA
"In 2022, Nicaraguans and Venezuelans (only October to December) started their applications by obtaining an appointment to formalize their asylum claim. The appointment process for Nicaraguans and Venezuelans ended in December 2022.",2022,,CRI,ASY
"The United States of America has also offered temporary status in certain circumstances to people in need of international protection. For example, in 2022, a significant number of Ukrainians and their immediate family members were given temporary protection on a humanitarian basis in the United States. UNHCR is in discussions with the U.S. government about how to best reflect such datapoints for all relevant populations in future reporting cycles.",2022,,USA,
"There is no official data on statelessness in Poland. The reported figure refers to the number of stateless persons holding a personal identification number issued by the Government, which does not cover all stateless people in the country.",2023,,POL,STA
"The refugee population in Jordan includes 31,000 Iraqis registered with UNHCR. The Government of Jordan estimated the number of Iraqis at 400,000 individuals at the end of March 2015. This includes refugees and other categories of Iraqis.",2022,,JOR,REF
"Data for the number of refugees is as of mid-2022.",2022,,BOL,REF
"The figure is an estimate based on various sources.",2023,,IRQ,STA
"There are indications that a potentially sizable population of non-displaced stateless persons exists for whom no data is available.","2022 - 2023",,IDN,STA
